{
  "meta": {
    "project_id": "PROJECT-WORK-ORDER",
    "project_name": "工单处理系统（示例）",
    "phase": "一期",
    "model_version": "1.0.0",
    "baseline_id": "BASELINE-WO-001",
    "review_status": "approved",
    "reviewer": "业务负责人、领域负责人、模型审核人",
    "review_date": "2026-07-30",
    "review_files": [
      "models/review/00-建模范围.md",
      "models/review/01-流程建模台账.md",
      "models/review/02-领域建模台账.md",
      "models/review/03-状态与规则台账.md",
      "models/review/04-接口与消息台账.md",
      "models/review/05-证据与待确认问题.md",
      "models/review/06-模型审核记录.md"
    ],
    "ontology_iri": "https://example.com/ontology/work-order#",
    "ontology_id": "work-order-ontology"
  },
  "scope": {
    "business_domain": "通用工单处理",
    "goals": [
      "打通外部任务接入、结果处理和结果数据准备流程"
    ],
    "in_scope": [
      "软件流程、任务、结果计算和半自动结果数据准备"
    ],
    "out_of_scope": [
      "外部设备接口实施",
      "一期全自动结果生成"
    ],
    "constraints": [
      {
        "dimension": "一期边界",
        "requirement": "系统准备结果数据，人工确认和应用结果",
        "source": "项目范围确认",
        "evidence_ids": [
          "EV-001"
        ]
      }
    ],
    "success_metrics": [
      {
        "metric": "试运行结果",
        "target": "业务用户确认可用",
        "measurement": "用户试运行"
      }
    ]
  },
  "roles": [
    {
      "role_id": "ROLE-SYSTEM",
      "name": "系统",
      "responsibilities": [
        "接收任务数据",
        "准备结果数据"
      ],
      "usage_frequency": "高",
      "evidence_ids": [
        "EV-001"
      ]
    },
    {
      "role_id": "ROLE-TESTER",
      "name": "处理员",
      "responsibilities": [
        "确认处理结果"
      ],
      "usage_frequency": "高",
      "evidence_ids": [
        "EV-001"
      ]
    }
  ],
  "scenarios": [
    {
      "scenario_id": "SC-RESULT-PREP",
      "name": "工单结果准备",
      "description": "系统取得任务和结果数据并准备供人工应用的结果数据",
      "role_ids": [
        "ROLE-SYSTEM",
        "ROLE-TESTER"
      ],
      "process_ids": [
        "PROC-RESULT-PREP"
      ],
      "priority": "Must",
      "evidence_ids": [
        "EV-001"
      ],
      "question_ids": [
        "Q-RESULT-FIELDS"
      ]
    }
  ],
  "processes": [
    {
      "process_id": "PROC-RESULT-PREP",
      "name": "工单结果数据准备流程",
      "scenario_ids": [
        "SC-RESULT-PREP"
      ],
      "trigger": "上游业务系统产生工单",
      "start_event": "收到工单",
      "end_result": "形成待人工确认的结果数据集",
      "role_ids": [
        "ROLE-SYSTEM",
        "ROLE-TESTER"
      ],
      "entity_ids": [
        "ENT-TEST-TASK",
        "ENT-TEST-RESULT"
      ],
      "interface_ids": [
        "IF-TASK-IMPORT"
      ],
      "evidence_ids": [
        "EV-001"
      ],
      "question_ids": [
        "Q-RESULT-FIELDS"
      ],
      "participants": [
        {
          "participant_id": "PART-LAB-SYSTEM",
          "name": "工单处理系统",
          "process_ref": true,
          "role_ids": [
            "ROLE-SYSTEM",
            "ROLE-TESTER"
          ],
          "evidence_ids": [
            "EV-001"
          ],
          "lanes": [
            {
              "lane_id": "LANE-SYSTEM",
              "name": "系统",
              "role_id": "ROLE-SYSTEM",
              "evidence_ids": [
                "EV-001"
              ]
            },
            {
              "lane_id": "LANE-TESTER",
              "name": "处理员",
              "role_id": "ROLE-TESTER",
              "evidence_ids": [
                "EV-001"
              ]
            }
          ]
        },
        {
          "participant_id": "PART-SAP-OA",
          "name": "上游业务系统",
          "process_ref": false,
          "role_ids": [],
          "evidence_ids": [
            "EV-001"
          ],
          "lanes": []
        }
      ],
      "nodes": [
        {
          "node_id": "ND-START",
          "name": "收到工单",
          "type": "startEvent",
          "participant_id": "PART-LAB-SYSTEM",
          "lane_id": "LANE-SYSTEM",
          "actor_role_id": "ROLE-SYSTEM",
          "trigger": "外部任务到达",
          "inputs": [
            "工单消息"
          ],
          "outputs": [
            "流程实例"
          ],
          "capability_ids": [],
          "entity_ids": [
            "ENT-TEST-TASK"
          ],
          "rule_ids": [],
          "state_ids": [],
          "interface_ids": [
            "IF-TASK-IMPORT"
          ],
          "exception_ids": [],
          "evidence_ids": [
            "EV-001"
          ],
          "question_ids": [
            "Q-INTERFACE-CONTRACT"
          ]
        },
        {
          "node_id": "ND-IMPORT-TASK",
          "name": "导入工单",
          "type": "serviceTask",
          "participant_id": "PART-LAB-SYSTEM",
          "lane_id": "LANE-SYSTEM",
          "actor_role_id": "ROLE-SYSTEM",
          "trigger": "收到外部任务",
          "inputs": [
            "外部任务字段"
          ],
          "outputs": [
            "标准化工单"
          ],
          "capability_ids": [
            "CAP-TASK-IMPORT"
          ],
          "entity_ids": [
            "ENT-TEST-TASK"
          ],
          "rule_ids": [
            "R-TASK-COMPLETE"
          ],
          "state_ids": [
            "ST-TASK-IMPORTED"
          ],
          "interface_ids": [
            "IF-TASK-IMPORT"
          ],
          "exception_ids": [
            "EX-TASK-INCOMPLETE"
          ],
          "evidence_ids": [
            "EV-001"
          ],
          "question_ids": [
            "Q-INTERFACE-CONTRACT"
          ]
        },
        {
          "node_id": "GW-TASK-COMPLETE",
          "name": "任务数据是否完整",
          "type": "exclusiveGateway",
          "participant_id": "PART-LAB-SYSTEM",
          "lane_id": "LANE-SYSTEM",
          "actor_role_id": "ROLE-SYSTEM",
          "trigger": "任务标准化完成",
          "inputs": [
            "标准化工单"
          ],
          "outputs": [
            "完整性判断"
          ],
          "gateway_condition": "按 R-TASK-COMPLETE 判断",
          "capability_ids": [
            "CAP-TASK-IMPORT"
          ],
          "entity_ids": [
            "ENT-TEST-TASK"
          ],
          "rule_ids": [
            "R-TASK-COMPLETE"
          ],
          "state_ids": [],
          "interface_ids": [],
          "exception_ids": [
            "EX-TASK-INCOMPLETE"
          ],
          "evidence_ids": [
            "EV-001"
          ],
          "question_ids": []
        },
        {
          "node_id": "ND-PREPARE-RESULT",
          "name": "准备结果数据",
          "type": "serviceTask",
          "participant_id": "PART-LAB-SYSTEM",
          "lane_id": "LANE-SYSTEM",
          "actor_role_id": "ROLE-SYSTEM",
          "trigger": "任务数据完整",
          "inputs": [
            "处理结果"
          ],
          "outputs": [
            "结果数据集"
          ],
          "capability_ids": [
            "CAP-RESULT-DATA-PREP"
          ],
          "entity_ids": [
            "ENT-TEST-RESULT"
          ],
          "rule_ids": [
            "R-RESULT-NORMALIZE"
          ],
          "state_ids": [
            "ST-RESULT-PREPARED"
          ],
          "interface_ids": [],
          "exception_ids": [],
          "evidence_ids": [
            "EV-001"
          ],
          "question_ids": [
            "Q-RESULT-FIELDS"
          ]
        },
        {
          "node_id": "ND-HUMAN-CONFIRM",
          "name": "人工确认结果数据",
          "type": "userTask",
          "participant_id": "PART-LAB-SYSTEM",
          "lane_id": "LANE-TESTER",
          "actor_role_id": "ROLE-TESTER",
          "trigger": "结果数据集生成",
          "inputs": [
            "结果数据集"
          ],
          "outputs": [
            "已确认结果数据"
          ],
          "capability_ids": [
            "CAP-RESULT-DATA-PREP"
          ],
          "entity_ids": [
            "ENT-TEST-RESULT"
          ],
          "rule_ids": [],
          "state_ids": [
            "ST-RESULT-CONFIRMED"
          ],
          "interface_ids": [],
          "exception_ids": [],
          "evidence_ids": [
            "EV-001"
          ],
          "question_ids": [
            "Q-RESULT-FIELDS"
          ]
        },
        {
          "node_id": "ND-MANUAL-HANDLE",
          "name": "人工处理不完整任务",
          "type": "userTask",
          "participant_id": "PART-LAB-SYSTEM",
          "lane_id": "LANE-TESTER",
          "actor_role_id": "ROLE-TESTER",
          "trigger": "任务完整性校验不通过",
          "inputs": [
            "不完整任务和错误信息"
          ],
          "outputs": [
            "人工处理记录"
          ],
          "capability_ids": [
            "CAP-TASK-IMPORT"
          ],
          "entity_ids": [
            "ENT-TEST-TASK"
          ],
          "rule_ids": [],
          "state_ids": [],
          "interface_ids": [],
          "exception_ids": [
            "EX-TASK-INCOMPLETE"
          ],
          "evidence_ids": [
            "EV-001"
          ],
          "question_ids": []
        },
        {
          "node_id": "ND-END",
          "name": "结果数据准备完成",
          "type": "endEvent",
          "participant_id": "PART-LAB-SYSTEM",
          "lane_id": "LANE-SYSTEM",
          "actor_role_id": "ROLE-SYSTEM",
          "trigger": "人工确认完成",
          "inputs": [
            "已确认结果数据"
          ],
          "outputs": [
            "流程结束"
          ],
          "capability_ids": [],
          "entity_ids": [
            "ENT-TEST-RESULT"
          ],
          "rule_ids": [],
          "state_ids": [],
          "interface_ids": [],
          "exception_ids": [],
          "evidence_ids": [
            "EV-001"
          ],
          "question_ids": []
        }
      ],
      "flows": [
        {
          "flow_id": "FLOW-001",
          "source": "ND-START",
          "target": "ND-IMPORT-TASK",
          "name": "任务到达",
          "condition": "",
          "rule_ids": [],
          "evidence_ids": [
            "EV-001"
          ],
          "question_ids": []
        },
        {
          "flow_id": "FLOW-002",
          "source": "ND-IMPORT-TASK",
          "target": "GW-TASK-COMPLETE",
          "name": "校验",
          "condition": "",
          "rule_ids": [
            "R-TASK-COMPLETE"
          ],